{
  "Name": "Comprehensive Multimodal Psychology Research Dataset",
  "BIDSVersion": "1.9.0",
  "DatasetType": "raw",
  "License": "CC-BY-4.0",
  "Authors": [
    {
      "name": "Dr. Maria Neuroscience",
      "orcid": "0000-0002-1825-0097",
      "affiliation": "University of Graz",
      "ror": "https://ror.org/02k40bc56"
    },
    {
      "name": "Prof. Cognitive Psychology",
      "orcid": "0000-0003-1234-5678",
      "affiliation": "Medical University of Graz",
      "ror": "https://ror.org/05cqkqw55"
    }
  ],
  "Funding": [
    {
      "agency": "Austrian Science Fund (FWF)",
      "grant_number": "P12345-B27",
      "funder_id": "https://doi.org/10.13039/501100002428"
    }
  ],
  "EthicsApprovals": [
    {
      "committee": "University of Graz Ethics Committee",
      "approval_number": "EK-2024-001",
      "date": "2024-01-15"
    }
  ],
  "DatasetDOI": "10.5281/zenodo.1234567",
  "Description": "This dataset contains comprehensive multimodal psychological research data including EEG, eye-tracking, physiological measures, and behavioral responses collected during cognitive tasks.",
  "Keywords": [
    "psychology",
    "neuroscience",
    "multimodal",
    "EEG",
    "eye-tracking",
    "cognition",
    "behavior",
    "FAIR"
  ],
  "ResearchDomains": [
    "cognitive neuroscience",
    "experimental psychology",
    "human computer interaction"
  ],
  "Acknowledgements": "We thank all participants and the technical staff for their contributions.",
  "ReferencesAndLinks": [
    "https://github.com/MRI-Lab-Graz/psycho-validator",
    "https://bids.neuroimaging.io/"
  ],
  "DataCollection": {
    "start_date": "2024-01-01",
    "end_date": "2024-06-30",
    "location": "University of Graz Psychology Lab"
  },
  "Publications": [
    {
      "title": "FAIR Psychology Data Management with Psycho-Validator",
      "doi": "10.1000/xyz123",
      "year": "2024"
    }
  ],
  "Contact": {
    "name": "Dr. Maria Neuroscience",
    "email": "maria.neuroscience@uni-graz.at",
    "orcid": "0000-0002-1825-0097"
  },
  "GeneratedBy": [
    {
      "Name": "psycho-validator",
      "Version": "1.2.0",
      "CodeURL": "https://github.com/MRI-Lab-Graz/psycho-validator"
    }
  ]
}
