{
  "Name": "Psychophysiology Test Dataset",
  "BIDSVersion": "1.8.0",
  "DatasetType": "raw",
  "Authors": [
    "Test Author"
  ],
  "Description": "A test dataset for validating psychophysiology data with various modalities including images, movies, and audio stimuli.",
  "License": "CC0",
  "Acknowledgements": "This is a test dataset for validation purposes."
}
